{
  "cache_path": "data/WikiCS",
  "commit_hash": "3e3126a4835186920e39dc9f250c6472aaa1638e",
  "created_at": "2026-06-25T17:16:26Z",
  "data_access_mode": "controlled_download",
  "dataset_name": "Wiki-CS",
  "download_attempted": true,
  "download_source": "pyg_official_loader",
  "error_message": null,
  "evaluation_setting": "transductive",
  "graph_visibility": "metadata probe only; no training/evaluator/pilot run",
  "has_labels": true,
  "has_masks_or_official_splits": true,
  "loader_backend": "pyg_wikics",
  "loader_status": "available",
  "local_cache_used": true,
  "num_classes": 10,
  "num_edges": 431726,
  "num_features": 300,
  "num_nodes": 11701,
  "split_source": "official_wikics"
}
