{
  "cache_path": "data/Planetoid",
  "commit_hash": "3e3126a4835186920e39dc9f250c6472aaa1638e",
  "created_at": "2026-06-25T17:16:26Z",
  "data_access_mode": "controlled_download",
  "dataset_name": "Cora",
  "download_attempted": true,
  "download_source": "pyg_official_loader_cache_reread_after_raw_github_endpoint_fallback",
  "error_message": null,
  "evaluation_setting": "transductive",
  "graph_visibility": "metadata probe only; no training/evaluator/pilot run",
  "has_labels": true,
  "has_masks_or_official_splits": true,
  "loader_backend": "pyg_planetoid",
  "loader_status": "available",
  "local_cache_used": true,
  "num_classes": 7,
  "num_edges": 10556,
  "num_features": 1433,
  "num_nodes": 2708,
  "split_source": "custom_stratified_random_1_1_8"
}
